domain,base_category,short_description,keywords
edraak.org,productive,الناك هو منصة إلكترونية عربية تع lượt دورات이자 مفتوحة المصادر (MOOCs) باللغة العربية، توفر برامج تعليمية مجانية في مجالات متنوعة مثل الاستعداد الوظيفي، التكنولوجيا، تطوير الذات، الأعمال، واللغات، بدعم من مؤسسة الملكة رانيا للتعليم والتنمية وشركاء أخ申.,"دورات ऑनलाइन بالعربية, moocs العربية, تعلم مجاني عبر الإنترنت, تطوير مهارات باللغة العربية"
edublogs.org,productive,"Edublogs offers free blogs for education, serving teachers, students, and institutions worldwide with a trusted web publishing platform.","education blogs, free educational blogging, teacher student web publishing"
educatorstechnology.com,productive,"EdTech resources & innovative technology for teachers, educators, parents, and students, including AI tools, online learning, and educational apps.","edtech resources, educational ai tools, online learning for education"
edutopia.org,productive,"Edutopia offers free resources, strategies, and inspiration for preK-12 educators, covering topics like project-based learning, social-emotional learning, and teacher wellness.","prek-12 education resources, teaching strategies, teacher wellness"
edwardjones.com,productive,"Discover personalized wealth management, retirement planning, and investment services with over 20,000 financial advisors at Edward Jones.","wealth management, financial advisors, retirement planning"
edx.org,productive,"Discover thousands of online courses, certifications, and degree programs from world-class institutions like Harvard, MIT, and more on edX.","online courses, professional certificates, university degrees, edx, moocs"
edx.org/business,productive,"edx.org/business: Upskill with online business courses, executive education, and certificates from top universities like MIT & Harvard, covering AI, finance, and more.","online business courses, executive education, business certificates"
edx.org/learn/computer-science,productive,"Explore online computer science courses & programs at edX. Learn programming, AI, cybersecurity & more from top universities.","online computer science courses, computer science programs, cs learning platform"
eevblog.com/forum,productive,"EEVblog Electronics Community Forum, a free & open forum for electronics enthusiasts and professionals to discuss electronics projects, repair, and more.","electronics forum, electronics community, electronics projects"
efinity.io/marketplace,addictive,Enjin Blockchain - Built for NFT & Gaming Proof-of-Stake Scalability & Interoperability,"nft blockchain, gaming blockchain, enjin blockchain"
egress.com,productive,"Egress provides Intelligent Email Security & Data Protection Solutions, shielding against phishing, data breaches, and enhancing email security with encryption and DLP.","email security solutions, data loss prevention, anti-phishing protection"
eharmony.com,distracting,"Find real love with eharmony, a trusted online dating site with a proven track record of matching singles for lasting relationships.","online dating, find love, dating site"
elai.io,productive,Create AI-generated videos from text with Elai.io's innovative platform.,"ai video creation, text-to-video, elai.io"
eldorado.gg,addictive,"Buy game currencies, accounts, and items safely from verified sellers on Eldorado.gg, with 24/7 customer support and a money-back guarantee.","game currencies, accounts for sale, gaming marketplace"
electric-sql.com,productive,"ElectricSQL is a Postgres sync engine that solves the hard problems of sync, allowing developers to build fast, collaborative, and real-time software applications.","postgres sync engine, real-time data sync, cloud-based data delivery"
electrum.org,productive,"Fast, secure, and easy-to-use Bitcoin wallet with advanced features like multisig, cold storage, and proof checking.","bitcoin wallet, electrum, cryptocurrency wallet"
element.io,productive,"Element.io offers Element, a Matrix-based, end-to-end encrypted messenger and secure collaboration platform for sovereign, self-hosted, or cloud-hosted real-time communications.","secure messaging app, matrix network, end-to-end encryption, self-hosted collaboration platform"
element.io/call,productive,Element.io cookies policy and settings for a better website experience.,"cookie policy, element.io, website cookies"
elevate.money,productive,Start investing in real estate and earn passive income through Elevate Money's fractional ownership and income-focused REIT.,"real estate investing, fractional ownership, reit"
elevenlabs.io,productive,"ElevenLabs.io offers AI-powered Text to Speech, Voice Cloning, Dubbing, and Audiobook solutions for creators and enterprises, with scalable, secure, and customizable voice technologies in 32 languages.","ai voice generator, text to speech, voice cloning"
elinks.or.cz,neutral,"ELinks: Advanced, feature-rich, open-source text mode web browser with HTML, FTP, scripting support & customization options.","elinks, text mode browser, open source web browser"
elitesingles.com,distracting,"EliteSingles is a serious online dating site for educated singles looking for long-lasting love. Our intelligent matchmaking algorithm delivers compatible matches based on personality, preferences, and education.","online dating, educated singles, serious relationships"
ellipal.com,productive,"ELLIPAL offers secure crypto hardware wallets and accessories for safeguarding digital assets, with free shipping and 30-day returns.","crypto hardware wallets, cold wallets, secure digital assets"
ellucian.com,productive,"Higher education technology solutions empowering institutions with flexible, integrated systems for student lifecycle, financial management, and analytics.","higher ed technology, student information systems, erp for education, education software solutions, campus management systems"
elmundo.es,distracting,"EL MUNDO: Spanish online newspaper leading in news, current events, and information from Spain and the world","noticias en español, diario online españa, actualidad mundial"
elpais.com,distracting,"Global news and current events from the United States and around the world, covering politics, economy, sports, culture, and more.","news, international, politics, current events"
elucidat.com,productive,"This document details a comprehensive list of cookies used by a website, including their purpose, duration, and associated services like Google Analytics, Hotjar, Facebook, and HubSpot. It covers various categories of cookies, such as analytics, advertising, session management, and user tracking, providing insights into how the website collects and utilizes user data for performance analysis, targeted advertising, and personalized experiences.","cookies, analytics, advertising, tracking, session management, google analytics, hotjar, facebook, hubspot, privacy, data collection, website performance, user experience"
elude.in,productive,"Elude.in domain not found, setup a page or website with FastMail guidance.","domain setup, website creation, fastmail guidance"
emacswiki.org,productive,"EmacsWiki: Community-driven documentation & resources for Emacs & XEmacs, including tutorials, customizations, and EmacsLisp.","emacs, emacslisp, xemacs, emacs documentation"
emedicine.medscape.com,neutral,"Medscape eMedicine: Peer-reviewed, searchable clinical reference with up-to-date medical articles, slideshows, & practice-changing evidence across various specialties.","clinical reference, medical articles, medscape emedicine"
emedicinehealth.com,neutral,"eMedicineHealth offers consumer health info, first aid, emergency guides, symptoms checker, and wellness articles from experts.","health information, first aid guide, symptoms checker, emergency medical advice"
emory.edu,productive,"This document outlines various aspects of Emory University, including student internships in Atlanta, financial aid programs like Emory Advantage, and research initiatives like the Center for New Medicines. It also details health-related programs and resources available at the university.","emory university, atlanta, internships, financial aid, emory advantage, loans, research, center for new medicines, health, medicine, students, research, atlanta, georgia"
endel.io,productive,"Personalized soundscapes to help you focus, relax, and sleep, backed by neuroscience","soundscapes, focus, relax, sleep, neuroscience"
enjin.com/platform/mobile-apps,addictive,"A collection of logos representing various projects and organizations within the Enjin ecosystem. The logos showcase a diverse range of blockchain games, platforms, and services, including gaming, wallets, marketplaces, and infrastructure providers. The visual style varies, with some logos being modern and minimalist, while others are more detailed and illustrative.","enjin, blockchain, gaming, nft, crypto, logos, projects, ecosystem, platforms, services, gaming, wallet, marketplace, infrastructure"
enjin.io/ecosystem/games,addictive,"Enjin Ecosystem Games page, serving as a hub for blockchain gaming experiences, NFT integration, and gaming communities. Redirecting to explore Enjin's gaming projects and solutions.","enjin ecosystem, blockchain gaming, nft gaming, enjin games"
enjin.io/products/marketplace,addictive,"NFT marketplace for creating, buying, selling, and distributing NFTs and crypto collectibles on web3.","nft marketplace, crypto collectibles, web3 nft platform"
enpass.io,neutral,"Enpass is a password manager that prioritizes user privacy and control. It allows users to store passwords and other sensitive data locally, syncing them via secure methods like Dropbox, Google Drive, or OneDrive. It offers cross-platform compatibility (Windows, macOS, Linux, Android, iOS) and boasts strong encryption.  It's praised for its offline functionality, extensive features, and user-friendly interface. Reviews highlight its security advantages due to not storing data on its own servers and its active support for Linux. It offers a free tier with limitations and paid subscriptions for premium features.","password manager, security, privacy, cross-platform, offline, encryption, windows, macos, linux, android, ios, dropbox, google drive, onedrive, free, subscription"
ens.domains,productive,"Register a simple, memorable Ethereum Name Service (ENS) name for seamless Web3 and internet identity management.","ethereum name service, ens registration, web3 identity management"
ens.vision,productive,"Marketplace for buying, selling & managing Web2 (.com, .org, etc.) and Web3 (ENS, .eth) domains with search, exploration, and category filters.","web3 domain marketplace, ens domain trading, web2 & web3 domain management"
ente.io,neutral,"Secure, end-to-end encrypted cloud storage for photos, videos, and more. Privately store, share, and organize memories with AI search across all devices.","private cloud storage, end-to-end encrypted photos, secure media sharing"
enterprise.com,neutral,Rent cars at great rates with easy booking from thousands of locations. Book now with Enterprise!,"car rental, enterprise rent-a-car, airport car rentals"
epicbrowser.com,neutral,"Epic Privacy Browser: A private, secure web browser that blocks ads, trackers, fingerprinting, and more, ensuring your online privacy and security.","private browser, secure browser, ad blocker, tracking protection, online privacy"
epicgames.com/store,addictive,"This is a list of deals and promotions available on the Epic Games Store. It includes Fortnite collaborations, new item shops, and significant discounts on various games like Need for Speed, Plants vs. Zombies, MotoGP, We Love Katamari, Tomb Raider, and more.  Deals range from 25% to 85% off original prices.","epic games store, deals, promotions, fortnite, need for speed, plants vs. zombies, motogp, we love katamari, tomb raider, discounts, sales, gaming, epic games"
epicnpc.com,addictive,"EpicNPC: Please wait for a moment, loading in progress...","loading, waiting, epicnpc"
epoctimes.com,distracting,Domain for sale: epoctimes.com. Click to learn more and purchase.,"domain for sale, epoctimes.com, website sale"
eporner.com,addictive,"Eporner is an adult content platform providing access to adult-only text, photos, and videos, complying with U.S. regulations and offering parental control measures.","adult content, eporner, parental controls"
equifund.com,productive,"Access curated private equity investments in metals, energy, real estate, healthcare, and AI via Equifund, a private market investment platform.","private equity investments, private market investing, sector-specific investment platforms"
escapefromtarkov.com/forum,addictive,Access denied due to unusual traffic activity from your computer network on Escape from Tarkov forum.,"escape from tarkov, forum, access denied"
eschoolplus.com,productive,"Maximize school efficiency with eschoolplus.com, comprehensive software for streamlined administration, enhanced communication, and improved student outcomes.","school management software, student outcomes improvement, administrative task automation"
eset.com,neutral,"ESET provides comprehensive IT security solutions for home, business, and enterprise, offering antivirus, internet security, and cybersecurity protection across various devices and platforms.","antivirus software, cybersecurity solutions, internet security protection"
eslgaming.com/forum,addictive,"ESL Gaming Forum (currently not found): Discuss esports, tournaments, and gaming with the ESL community.","esl forum, esports community, gaming discussion"
espn.com,distracting,"ESPN offers live sports scores, highlights, news, exclusive games on ESPN+, fantasy sports, and betting odds, catering to global sports fans across various leagues and events.","sports scores, espn+, fantasy sports, live sports streaming, sports news"
espnesports.com,addictive,"Official site of ESPN Sports, offering sports news, scores, and updates.","espn sports, sports news, scores updates"
esports.gg,addictive,"esports.gg is the premier hub for esports news, guides, and more, covering competitive gaming titles like LoL, Dota 2, Valorant, and more.","esports, gaming news, competitive gaming, lol, dota 2, valorant"
esportsarena.com,addictive,"Under Construction - Copyright 1999-2025 GoDaddy, LLC. All rights reserved.","godaddy, under construction, domain placeholder"
esportscharts.com,addictive,"Buy esportscharts.com domain name for sale, fill out the form to get a price within 24 hours","domain for sale, esportscharts, buy domain"
esportsearnings.com,addictive,"Esports Earnings tracks competitive gaming prize money, results, history, and statistics across various games and tournaments.","esports prize money, competitive gaming statistics, tournament results"
esportsheaven.com,addictive,"EsportsHeaven: Your hub for esports news, features, videos, events, and in-depth guides across various games like CSGO, LOL, Overwatch, and more.","esports news, esports guides, csgo, league of legends, overwatch"
esportsinsider.com,addictive,"Esports Insider delivers the latest esports, gaming, and betting industry news, featuring guides, features, and updates on competitive titles.","esports news, gaming industry updates, competitive gaming titles"
esportsnews.com,addictive,Domain for sale: esportsnews.com - Get a price in less than 24 hours!,"domain for sale, esportsnews, domain buying"
esportstalk.com,addictive,"Stay updated with the latest esports news, updates, and videos on games like CSGO, Fortnite, League of Legends, and more at Esports Talk.","esports news, esports updates, competitive gaming news"
esportstalk.com/forums,addictive,"EsportsTalk.com: Discuss latest esports news, trends & strategies in our forums across various games like LoL, CS:GO, Fortnite & more.","esports forums, esports discussion, gaming community"
estimize.com,productive,"Estimize: Crowdsourced earnings & macroeconomic estimates from 120,000+ contributors, offering accurate data, analytics tools, and subscription plans.","earnings estimates, crowdsourced financial data, economic forecasting platform"
ethereum.org,productive,"The official guide to Ethereum, a leading platform for blockchain innovation and decentralized apps, featuring wallet creation, asset management, and more.","ethereum, blockchain, decentralized apps, wallet creation, asset management"
ethereumclassic.org,productive,"Ethereum Classic (ETC) official site: Decentralized, secure, & censorship-resistant blockchain for unstoppable applications, with developer tools, NFTs, & community resources.","ethereum classic, etc, decentralized blockchain"
ethers.org,productive,"Ethers is a JavaScript library for all Ethereum needs, providing a simple, compact, and complete solution.","ethereum library, javascript for ethereum, ethers library"
etherscan.io,productive,"Explore the Ethereum blockchain with Etherscan, a comprehensive blockchain explorer providing real-time data on transactions, blocks, accounts, tokens, and more.","ethereum, blockchain explorer, eth price, gas tracker"
ethos.network,productive,"Ethos Network: Decentralized trust & reputation platform for Web3, providing on-chain credibility scores to combat crypto scams & fraud.","web3 reputation platform, on-chain credibility score, decentralized trust system, crypto scam prevention"
etoro.com,productive,"Invest in 7,000+ assets on eToro, a trusted multi-asset trading platform with copy trading, demo accounts, and advanced tools for stocks, crypto, and more.","multi-asset trading platform, copy trading, crypto investing"
etoro.com/crypto,productive,"Invest in 100+ cryptos on eToro, a trusted global platform with copy trading, staking rewards, and a 30M+ community for secure crypto management.","crypto trading platform, etoro crypto, cryptocurrency investment"
etrade.com,productive,"Invest, trade, and plan for retirement with E*TRADE. Offers brokerage accounts, investment choices, trading platforms, and financial knowledge.","online investing, trading platform, retirement accounts, brokerage services"
euler.finance,productive,"Euler Finance is a modular lending platform for limitless lending, borrowing, and building.","lending platform, modular lending, defi development"
eurogamer.net,addictive,"Eurogamer.net: Video game news, reviews, guides, and features for PC, PlayStation, Xbox, Nintendo, and more since 1999.","video game news, game reviews, gaming guides, pc gaming, console gaming"
european.com,neutral,European.com provides website content and image rendering services,"website content, image rendering, url rendering"
evernote.com,productive,"This is a webpage promoting Evernote, a note-taking application. It highlights features like organizing notes, collaborating, and accessing information across devices. The page uses numerous images showcasing various note types (docs, class notes, research, journal entries, task lists, meeting notes, wikis, planners) to illustrate Evernote's versatility.","evernote, note-taking, organization, productivity, collaboration, notes, digital notes, task management, document management, cloud storage, evernote features, digital planning"
everstake.one,productive,"Everstake.one: Trusted crypto staking service & validator for 70+ blockchain networks, offering secure, automated, and non-custodial staking with 99.9% uptime.","crypto staking service, blockchain validator, non-custodial staking"
ewha.ac.kr,productive,"Ewha Womans University official site: Education, Research, Admissions for Undergraduate, Graduate, Professional & Special Graduate Schools in Korea","ewha womans university, korean university, women's university, undergraduate & graduate programs"
excite.com,neutral,"Portal providing access to news, quick links, and resources across various categories such as entertainment, sports, finance, health, and more.","portal, news, quick links, resources"
exodus.com,productive,"Buy, swap, and manage cryptocurrencies with Exodus, a leading crypto wallet and Web3 platform offering staking rewards, crypto purchases, and web3 onboarding.","crypto wallet, bitcoin wallet, web3 wallet, crypto trading"
expedia.com,neutral,"Book your dream vacation with Expedia: Hotels, Vacation Homes, Car Rentals, Flights, Packages & More. Bundle & Save up to $974!","travel booking, vacation packages, flight & hotel deals"
expedia.com/flights,neutral,"Book flights on Expedia, a travel booking website, to find cheap airfare deals and compare prices.","flight booking, cheap airfare, expedia flights"
expertvagabond.com,neutral,"Travel blog by digital nomad Matthew Karsten, offering destination guides, travel tips, gear guides, and advice on living abroad as an expat and digital nomad.","digital nomad, travel guides, living abroad, travel tips"
expressvpn.com,neutral,"Protect your privacy, stream worldwide, and enjoy fast speeds with ExpressVPN, the #1 trusted leader in VPN with 30-day risk-free trial and 24/7 support.","vpn, virtual private network, internet privacy, fast speeds"
eztv.re,distracting,"EZTV Official Torrents Site - Download TV Series Online, TV Packs, and More.","tv series torrents, eztv torrents, online tv downloads"
f-droid.org,addictive,"F-Droid: An installable catalogue of Free & Open Source Android apps. Browse, install, and update FOSS apps on your device.","foss android apps, free open source android repository, f-droid app store"
f2movies.to,neutral,"Watch Free HD Movies & TV Series online on F2movies.to with no ads, signup, or cost. Stream or download over 10,000 titles in various genres.","free movie streaming, watch movies online free, free tv series streaming"
facebook.com/gaming,addictive,"Watch live video game streams from popular creators on Facebook Gaming, join a gaming community, and start streaming your own gameplay.","live gaming streams, facebook gaming community, video game streaming platform"
facebook.com/messenger,productive,"Log in or sign up to view and access Messenger, a messaging service provided by Facebook.","messenger, facebook, login, sign up"
facebook.com/workplace,productive,"Collaboration Tools for Business: Securely combine chat, video, groups, and intranet with work tools you already use.","collaboration tools, business communication, workplace platform"
faceit.com/forums,addictive,"Verify your humanity to access Faceit's gaming forums, a platform for gamers to discuss and connect.","gaming forums, faceit, human verification"
factorio.com/forums,addictive,"Official Factorio community forums for discussing game development, mods, and more.","factorio forums, gaming community, mod discussion"
fairphone.com,neutral,"Fairphone.com: Sustainable tech brand offering long-lasting, high-performing smartphones, audio devices, and accessories with a focus on social and environmental responsibility.","sustainable smartphones, fair trade electronics, repairable tech devices"
fakeyou.com,productive,Generate AI-powered celebrity voices & videos for custom text with FakeYou's innovative voice and video generator tool,"celebrity ai voice generator, ai video generator, custom ai voices"
fakku.net,addictive,"This appears to be a partial listing of content from the website FAKKU, showcasing various titles, artists, and prices. The content includes titles like 'Girlfriend Next Door', 'Moonflower Prequel', 'Let Me Be Your Sugar Daddy', and 'Satisfoxion', among others. It also lists artists such as Aiue Oka, Yumeno Tanuki, and Muo. The listing includes prices and links to the respective content pages.","fakku, hentai, anime, manga, aiue oka, yumeno tanuki, muo, girlfriend next door, moonflower prequel, let me be your sugar daddy, satisfoxion, content listing, artists, titles, prices"
fal.ai,productive,"fal.ai is a generative media platform for developers, offering lightning-fast inference and optimized access to high-quality generative media models.","generative media platform, ai inference engine, diffusion models"
falconstudios.com,addictive,"Explore Falcon Studios, the #1 gay site for over 50 years, featuring explicit gay videos, DVDs, and photos.","gay videos, explicit gay content, falcon studios"
falkon.org,neutral,"Falkon: Open-source KDE web browser prioritizing privacy, security with ad blocker & password manager, customizable with themes & extensions.","falkon browser, open source web browser, privacy focused browser, kde software"
falkordb.com,productive,"FalkorDB is a fast, scalable graph database using sparse matrices & linear algebra for AI/ML, GenAI, and real-time data. Ideal for structured/unstructured data, fraud detection, & chatbots.","graph database, ai/ml integration, genai solutions"
family.co,productive,"Family.co: Easy, Secure, Fast Ethereum Wallet for iOS with NFT Support, Swapping, Sending/Receiving & Self-Custody","ethereum wallet, ios crypto wallet, nft support, self-custodial wallet"
fandom.com,addictive,"Fandom.com: Entertainment hub for fans of TV, movies, games, anime, & more. Explore wikis, news, & community content across popular franchises.","fandom community, wiki platform, entertainment news"
fanduel.com,addictive,"Bet on sports, play fantasy games, and explore online casino options at FanDuel, with exclusive offers and promotions for new customers.","sports betting, fantasy sports, online casino"
fansly.com,addictive,Interact with your fans and monetize your content by creating a free account on Fansly.com,"fans monetization, content selling platform, creator fan interaction"
