domain,base_category,short_description,keywords
media.com,addictive,"Media.com is a trusted online community for verified users to share and engage with trusted content, free from anonymous users, fake profiles, and bots.","trusted content, verified profiles, online community"
mediafire.com,productive,"MediaFire is a free file storage service that allows users to store, access, and share files anywhere, with 10GB of free space and up to 50GB with bonuses.","file storage, cloud storage, file sharing"
mediatek.com/products/smartphones/gaming,addictive,"Explore MediaTek's cutting-edge technology for gaming smartphones, featuring advanced connectivity, AI, and display innovations.","gaming smartphones, mediatek, 5g"
medium.com,neutral,"Discover and share stories on Medium, a platform for readers and writers to explore ideas and deepen understanding.","storytelling, writing platform, reading community"
mednafen.github.io,addictive,"Mednafen is a multi-system video game emulator supporting various consoles & computers, with frequent updates for improved emulation accuracy and compatibility.","mednafen, multi-system emulator, retro gaming emulation"
medscape.com,neutral,"Free medical resource for physicians with latest news, clinical trials, drug updates, journal articles, CME activities, and perspectives across various specialties.","medical news, clinical trials, cme activities, physician resources"
meet.jit.si,productive,Secure video conferencing platform for online meetings and collaborations.,"video conferencing, online meetings, jitsi meet"
meetu.com,addictive,"Redirect to domainshop.com, a website that offers domain registration and online services.","domain registration, online services, domain shop"
meetup.com,addictive,"Discover local groups, events, and activities near you. Make new friends and connect with like-minded people through various meetups.","local events near me, meetup groups, social activities platform"
meew.com,addictive,"Domain meew.com for sale via Sedo Marketplace. Submit binding bids starting at $9,500 USD. Buy this premium domain today!","meew.com for sale, domain marketplace, sedo buying"
mega.nz,productive,"MEGA: Secure cloud storage, file sharing, chat, meetings, VPN, & password manager with end-to-end encryption for individuals & businesses.","cloud storage, secure file sharing, end-to-end encryption"
megabus.com,neutral,"Book affordable bus tickets online with megabus for convenient travel in the UK, USA, and Canada.","bus tickets, low cost travel, megabus"
megadice.com,addictive,Online dice gaming platform offering community engagement and exclusive promotions.,"dice games, online gaming, gambling promotions"
megamillions.com,addictive,"Mega Millions is a US lottery game offering big jackpot prizes up to $5 million and a Megaplier feature. Check winning numbers, learn how to play, and find where to buy tickets.","mega millions, lottery, jackpot"
megaplay.io,addictive,"MegaPlay.io offers a variety of original online slots and casino games with top, new, and hot slots available. Play popular titles like Ancient Mayan, Book of Ra, and more!","online slots, original slots, casino games, crypto gaming"
meistertask.com,productive,"MeisterTask is a work management software that helps teams achieve efficient project management, task management, and documentation with a secure central source of truth.","work management software, task management, project management"
melon.com,distracting,"Melon: No.1 뮤직플랫폼 for latest K-pop, music recommendations, charts, new albums, and streaming.","korean music platform, k-pop streaming, melon charts, music recommendations, korean albums"
mem.ai,productive,"Mem.ai - AI-powered notes app for busy professionals, offering offline mode, markdown editing, GPT-4 integration, and AI-driven organization tools.","ai notes app, ai organization tools, gpt-4 integration, offline note taking"
memrise.com,productive,"Immerse in authentic language learning with native speaker videos, practical scenarios, and AI feedback for confident speaking","language learning, authentic language practice, speak with native speaker videos"
memuplay.com,addictive,MEmu: Best Android Emulator for PC - Play Mobile Games on PC with Max Performance & Stunning Graphics - Free Download,"android emulator for pc, mobile gaming on pc, memu emulator"
mens.com,addictive,"Get ED and hair loss medication prescribed online and delivered to your door with Mens.com, a digital health clinic for men.","ed treatment, hair loss medication, digital health clinic"
mentalhealth.gov,neutral,"MentalHealth.gov: Find help, support, treatment, and resources for mental health, substance use, crisis, and recovery. Locate helplines, healthcare, and support groups.","mental health resources, substance use treatment, crisis helplines, mental health support"
mercycorps.org,neutral,"Mercy Corps is a global humanitarian organization working on the front lines of crises to create a future of possibility, where everyone can prosper.","humanitarian aid, global crisis response, emergency relief"
merriam-webster.com,productive,"Merriam-Webster: Dictionary, Quizzes, Word Games & Grammar Guides. Explore word meanings, play word games, and improve vocabulary with daily quizzes and games.","dictionary, word games, grammar guides, vocabulary builder"
merrilledge.com,productive,"Merrill Edge offers online investing, stock trading, and brokerage services, including retirement accounts, financial research, and expert guidance.","online investing, stock trading, brokerage"
meshy.ai,productive,"Meshy AI is a 3D model generator that transforms images and text into 3D models in seconds, offering powerful AI tools for creators.","ai 3d model generator, 3d model creation, ai-powered design"
messenger.com,productive,"Hang out anytime, anywhere—Messenger makes it easy and fun to stay close to your favorite people","messaging, social, community"
metacritic.com/game,addictive,"Aggregated video game reviews from top critics, with METASCORE summaries, plus articles, trailers, and release information.","video game reviews, game ratings, metascore"
metager.org,neutral,"Privacy-protected search engine - Secure, ad-free & multilingual search without tracking. Powered by a nonprofit organization.","privacy search engine, secure search, ad-free search, nonprofit search platform"
metaschool.so,productive,"Metaschool - Learn AI & Web3 through interactive projects, templates, and courses for builders.","ai development tutorials, web3 project templates, openai integration courses"
mewfinance.com,neutral,"Explore decentralized finance on the Ergo Blockchain with Mew Finance, offering a suite of dApps, including DEX, NFT Mart, Bank, and more.","decentralized finance, ergo blockchain, dapps, dex, nft marketplace"
mexc.com,neutral,"MEXC: Leading crypto exchange for trending tokens, low fees, everyday airdrops, spot & futures trading with comprehensive liquidity.","crypto exchange, trending tokens, low fee trading"
mgba.io,addictive,"mGBA is an open-source Game Boy Advance emulator, providing a way to play GBA games on various platforms.","mgba, game boy advance emulator, gba emulator"
micro.blog,addictive,"Micro.blog is a platform for easy blogging and sharing of thoughts, photos, and more, with a focus on a friendly community and slow-paced social interaction.","microblogging, blogging platform, social networking"
microcenter.com,distracting,"This is a webpage from Microcenter. It includes navigation elements like product categories, account options, and a cart. It also features a store locator and options for signing in or creating an account. The page emphasizes top deals and PC parts, particularly processors/CPUs.","microcenter, pc parts, processors, cpus, top deals, store locator, account, cart, navigation, products, deals"
microsoft.com/authenticator,neutral,"Microsoft Authenticator app protects your personal and business data from outside breaches, securely logging into your organization's applications.","microsoft authenticator, mobile authenticator app, two-factor authentication"
microsoft.com/edge,neutral,Microsoft Edge: AI-powered browser for smarter browsing,"microsoft edge, ai browser, smart browsing"
microsoft.com/education,productive,"Microsoft Education offers technology & software for schools, including AI-powered tools, Microsoft 365, & accessibility features to support equitable learning.","microsoft education, education technology, ai for schools, microsoft 365 for education"
microsoft.com/office,productive,"Microsoft 365 subscriptions include a set of familiar productivity apps, intelligent cloud services, and world-class security in one place.","microsoft 365, productivity apps, cloud services"
microsoft.com/onedrive,productive,"Microsoft OneDrive: Personal Cloud Storage – Access & store files, photos, & videos securely from any device. Free 5 GB storage.","cloud storage, onedrive, microsoft onedrive"
microsoft.com/onenote,productive,OneNote: Enhance digital note-taking with robust organization & seamless collaboration tools within Microsoft 365.,"onenote, digital note taking app, microsoft 365 collaboration tools"
microsoft.com/store/games,addictive,Discover & play popular Xbox & PC games on Microsoft Store. Buy new releases & enjoy sale deals on Windows PC games.,"windows pc games, xbox games, microsoft store games"
microsoft.com/teams,productive,"Microsoft Teams is a communication and collaboration platform that offers video conferencing, meetings, calling, and chat features to help teams stay organized and bring ideas to life.","video conferencing, team collaboration, microsoft teams"
microsoft.com/windows,addictive,"Discover Windows 11 OS, explore AI-powered features, and find the right PC or app for your needs.","windows 11, pc buying guide, ai features on windows, windows apps, gaming pcs"
microsoft365.com,productive,"Collaborate online with Microsoft 365, featuring Word, PowerPoint, Excel, and OneNote, plus cloud storage with OneDrive.","microsoft 365, online collaboration, productivity software"
microventures.com,productive,"Invest in vetted startups, raise capital, or trade private stock with MicroVentures, a full-service platform for equity crowdfunding and private market investments.","equity crowdfunding, startup investing, private market investments"
midjourney.com,productive,Midjourney is an independent research lab exploring new mediums of thought and expanding human imaginative powers.,"research lab, ai, human infrastructure"
midori-browser.org,neutral,"Midori Browser official website, providing access to the browser's resources and information.","midori browser, browser website, open source browser"
milffox.com,addictive,"Milf Fox offers a vast collection of hot milf porn movies, sex clips, and nude photos featuring sexy foxy moms in various categories","milf porn, hot milfs, milf sex videos"
milfzr.com,addictive,"Watch hundreds of free MILF and Mom porn videos, stepmom, stepsis & stepson Incest Porn and other HD MILF sex videos updated daily","milf porn, mom porn, incest porn, hd sex videos"
millionacres.com,productive,"Investing guidance & stock market insights from The Motley Fool's Million Acres, covering real estate, stocks, ETFs, and diversified investment strategies.","investing in real estate, stock market insights, diversified investment strategies"
milvus.io,productive,"Milvus: High-Performance, Scalable Vector Database for Similarity Search & GenAI Apps","vector database, genai, similarity search"
mind.org.uk,neutral,"Mental health charity providing information, support, and advice for those experiencing mental health problems, as well as resources for supporters and professionals.","mental health, charity, support"
minds.com,addictive,"Launch your own social media app in minutes on web, iOS, and Android, with custom integrations, monetization options, and ownership of data. Join the decentralized social media network with millions of users, featuring newsfeed, groups, chat, blogs, video, photos, and more. Build, customize, and own your community without relying on big tech.","decentralized social media, custom social app launch, monetizable community building"
minecraftforum.net,addictive,Verify human access to Minecraft Forum,"minecraft forum, human verification, security check"
minepi.com,neutral,"Mine Pi cryptocurrency on your phone with a free, energy-light mobile app. Start earning crypto easily and securely today!","pi cryptocurrency, mobile mining, crypto app"
mirandus.game,addictive,"Mirandus.game is an upcoming blockchain-based MMORPG by Gala Games, offering a unique gaming experience with ownership of in-game assets.","blockchain mmorpg, mirandus game, gala games, blockchain gaming"
mirror.xyz,neutral,"Discover web3 publishing on Mirror, a platform featuring curated content, delivered weekly, with a focus on innovation and community.","web3 publishing, curated content, community platform"
misskey.io,addictive,"Misskey.io is a decentralized microblogging SNS, part of the Fediverse. Connect with others and explore a new internet experience! (approx. 155 characters)","misskey, sns, fediverse, microblogging, decentralized"
mistral.ai,productive,"Mistral AI provides a complete, customizable AI solution from platform to interface, deployable anywhere, along with Le Chat, a versatile AI assistant for life and work.","customizable ai solutions, enterprise ai deployment, ai assistant app"
mit.edu,productive,"Explore the Massachusetts Institute of Technology (MIT), a world-renowned institution for education, research, and innovation.","mit, education, research, innovation"
mixedbread.com,productive,"Mixedbread offers an enterprise-grade RAG platform for precision search and data extraction, integrating with popular tools and delivering 40-60% higher accuracy and 95%+ extraction rates.","enterprise search, unstructured data, context-aware search"
mixer.com,addictive,Watch live video game streams from popular creators on Facebook Gaming. Join a community of players and streamers.,"facebook gaming, live streaming, video game streams"
mixminion.net,neutral,"Mixminion: Archive of Type III Anonymous Remailer protocol implementation with documentation, specs, and historical releases (not actively developed).","anonymous remailer, mixminion protocol, type iii anonymity"
mmo-champion.com,productive,"World of Warcraft news, guides, patch notes, previews, and raiding strategies at MMO-Champion.","world of warcraft news, wow raiding strategies, mmochampion"
mobilism.org,distracting,"Mobilism.org: Active online community forum with thousands of registered users, discussing various topics.","mobilism forum, online community, discussion boards"
mobx.js.org,productive,"MobX: Simple, Scaler State Management for JavaScript Apps - Reactive, Decoupled, and Efficient State Management Library","state management, reactive programming, mobx library"
moddb.com,addictive,"A collection of recent news and updates from ModDB, featuring mods and games across various genres including strategy, horror, and action. Highlights include a demo for Cosmic Fear, an anniversary for the Mega Weapons Pack for Doom II, updates for Black One: Blood Brothers, One More Bang, and more. New content focuses on character design, gameplay updates, and demo releases.","moddb, mods, games, cosmic fear, doom ii, black one: blood brothers, one more bang, anniversary, demo, update, character design, horror, action, strategy"
moddb.com/forum,addictive,"ModDB Forum - Official community for game developers & players to discuss game development, mods, and share ideas.","game development forums, mod db community, game modding discussions"
modthesims.info,addictive,"Mod The Sims: Free Sims 2, 3, & 4 Downloads, Tutorials, Mods, Discussions, and Community Hub.","sims 4 mods, sims 3 downloads, sims 2 custom content"
mofos.com,addictive,"Mofos is the home of the best sex, milf, and big boobs videos, featuring top pornstars in exclusive hardcore porn videos updated daily.","porn videos, milf porn, hardcore sex"
mojeek.com,neutral,"Mojeek is a private, unbiased search engine that provides fast and relevant results without tracking users.","private search engine, unbiased search results, no tracking"
mommygotboobs.com,addictive,"Experience Mommy Got Boobs content on Brazzers, offering exclusive adult videos and photos.","brazzers, adult content, mommy got boobs"
momondo.com,neutral,"This is a snapshot of flight deals and travel information from Momondo. It includes flight deals from Wichita (ICT), trending cities, and various travel tools like KAYAK.ai, trip planning, price alerts, and flight tracking. The deals are for travel in May 2025.","flights, travel, deals, momondo, wichita, ict, may 2025, kayak.ai, trip planning, price alerts, flight tracking, trending cities, deals, travel information"
momsbangteens.com,addictive,"HD porn videos featuring mature women and teens on RealityKings.com. Explore over 13,000 full-length videos now!","moms bang teens, realitykings, hd porn videos"
monday.com,productive,"Streamline workflows, gain clear visibility across teams, and empower smarter decisions with monday.com's Work Platform, offering AI-powered management for projects, CRM, IT, and more.","work management platform, ai-powered workflow automation, cross-team collaboration tool"
monese.com,productive,"This is a detailed breakdown of Monese account features and pricing, comparing the 'Classic' and 'Premium' tiers. It outlines various services including payments, transfers, credit building, insurance, cards, cash access, account management, and customer support, highlighting differences in limits and fees between the two plans.","monese, banking, account, classic, premium, features, pricing, payments, transfers, credit, insurance, cards, cash, support, fees, limits"
monster.com,productive,"Find your next job or career opportunity on Monster.com, a leading job search and career advice website.","job search, career advice, job opportunities"
moodgym.com.au,neutral,moodgym is an interactive self-help program providing cognitive behaviour therapy (CBT) training to help users prevent and cope with depression and anxiety.,"moodgym, cognitive behaviour therapy, depression and anxiety"
moodle.org/schools,productive,"Explore Moodle for schools: free, open-source Learning Platform for effective online courses, scalable from single-teacher to large institutions.","moodle for schools, open source lms, online course platform"
moomoo.com,productive,"Moomoo: Commission-Free Online Trading Platform for Stocks, Options, ETFs, and More with Real-time Quotes, Advanced Tools, and Promotions.","commission-free trading, online stock trading, options trading platform"
morpho.org,productive,"Morpho is a secure, efficient, and flexible lending platform for on-chain loans, trusted by top DeFi players.","on-chain loans, lending platform, defi"
motherjones.com,distracting,"Mother Jones: Award-winning journalism covering politics, environment, criminal justice, guns, race, and more with fearless, in-depth reporting.","progressive journalism, investigative reporting, politics news"
motherless.com,addictive,"Motherless.com is a user-generated content platform hosting a vast collection of videos and images, with a large active community sharing and discussing their interests.","adult content, file hosting, community forum"
motion.dev,productive,"Motion - A modern, open-source animation library for JavaScript, React, and Vue, offering easy-to-use APIs for smooth, high-performance animations.","motion animation library, javascript animation, react animation, vue animation"
movementlabs.xyz,productive,"Movement Labs is a blockchain network accelerating growth and adoption of Move protocol, fostering a global community of developers, builders, and innovators.","move protocol, blockchain network, decentralized development"
movementnetwork.xyz,productive,"The Movement Network is a cutting-edge platform for creating decentralized applications with MoveVM technology, fostering innovation and adoption.","movevm, decentralized applications, blockchain ecosystem"
moviesjoy.to,distracting,"Watch free HD movies & TV series online with subtitles, no signup required. Over 200,000 titles updated daily.","free movie streaming, watch tv series online, hd movies no signup"
mozilla.org,productive,"Empowering your digital life: Mozilla offers privacy-focused products (Firefox, VPN, Relay) & advocates for tech responsibility, AI ethics, and internet privacy through open-source initiatives and non-profit actions.","mozilla, privacy-focused browsing, open-source tech, ai ethics"
mozilla.org/firefox,neutral,"Download Firefox, a free, fast, reliable, and private web browser for Windows, Mac, or Linux, backed by Mozilla, promoting internet health and privacy.","firefox browser, free web browser, private browsing"
mozy.com,productive,"Domain registration and management services, including online brand monitoring and enforcement, domain consultancy, and cybersecurity solutions.","domain registration, domain management, online brand monitoring"
mrgreen.com,addictive,Mr Green services are currently unavailable in your location. Withdraw available funds by contacting support.,"mr green, services unavailable, fund withdrawal, online services"
msgsafe.io,productive,"MsgSafe.io: Private, end-to-end encrypted email service. Existing accounts will cease operation Feb 29, 2024. Save your data before then! New signups are no longer available.","encrypted email, private email, msgsafe, email service, end-to-end encryption"
msn.com,productive,"MSN offers personalized news, entertainment, sports, and lifestyle content, alongside Outlook, Office, Skype, and Bing services.","msn, news, entertainment, outlook"
msnbc.com,distracting,"Breaking news & live updates from MSNBC. Get the latest national, international, & local news from our team of reporters.","breaking news, live news updates, msnbc news"
mubert.com,productive,"Generate royalty-free music with Mubert's AI music generator, perfect for videos, podcasts, and apps.","ai music generator, royalty-free music, video soundtrack"
mud.dev,productive,MUD - Open-source framework simplifying Ethereum app development with integrated tools & infrastructure for onchain autonomous worlds.,"ethereum framework, onchain app development, open-source blockchain tools, mud platform"
mui.com,productive,"Move faster with MUI's comprehensive suite of free React UI tools, featuring Material UI, production-ready components, and customizable design systems.","react ui tools, material ui, component library"
mullvad.net,neutral,"Mullvad VPN & Browser protect your privacy from surveillance & censorship, offering a trustworthy VPN service with no personal data collection.","mullvad vpn, privacy protection, anti-surveillance vpn"
multilotto.com,addictive,"Default Apache2 server page, configure your server settings here.","apache2 server, server configuration, web hosting"
multporn.net,addictive,"Porn comics, Hentai manga, Cartoon and Hentai pics, GIF porn, Flash porn games, Cartoon and Hentai porn videos and more.","porn comics, hentai manga, gif porn"
mumble.info,addictive,"Mumble is a free, open-source voice chat application known for its low latency and high quality. Perfect for gaming, communities, and secure communication. Download now!","voice chat, mumble, low latency, gaming, voip"
murf.ai,productive,"Murf AI: AI voice generator for enterprises, offering 200+ realistic text-to-speech voices in 20+ languages, scalable via Studio, DubBING, and API for efficient voiceover production.","ai voice generator, enterprise text-to-speech, ai-powered voice infrastructure"
music.amazon.com,distracting,"Stream 100 million songs and podcasts on Amazon Music Unlimited, browse and play your favorite music and podcasts online for free.","amazon music unlimited, music streaming, podcasts"
music.apple.com,distracting,"Stream millions of songs, watch music videos, and experience live performances on Apple Music. Play on web, in app, or on Android with your subscription.","apple music, music streaming, music videos"
music.bugs.co.kr,distracting,"Discover music withérica playlists, essential player, and latest albums on Bugs! music.bugs.co.kr","korean music platform, music streaming, bugs music"
music.line.me,distracting,"LINE MUSIC is a music streaming service that offers unlimited access to a vast library of songs, high-quality music videos, and exclusive live broadcasts.","music streaming, line music, unlimited music"
music.rakuten.co.jp,distracting,"Rakuten Music - Unlimited music streaming with over 100 million tracks, various plans starting from ¥500/month, no ads, offline playback, and rewards.","rakuten music, music streaming japan, unlimited music subscription"
musicbrainz.org,neutral,"MusicBrainz is the open music encyclopedia, collecting and sharing music metadata under open licenses, enabling universal music identification and contribution from a global community.","open music encyclopedia, music metadata, music identification"
muslima.com,distracting,"Meet Muslim singles on Muslima, the most trusted Muslim dating site with over 7.5 million members. Join now and start making meaningful connections!","muslim matrimonials, muslim dating, islamic marriage"
muun.com,productive,"Muun - Self-Custodial Bitcoin Wallet for Android & iOS, enabling fast, cheap Lightning Network payments with advanced security features.","bitcoin wallet, self-custodial wallet, lightning network payments"
mycointainer.com,productive,Mycointainer provides a platform for tokens and coin usage tracking.,"coin tracking, token usage, cryptocurrency platform"
