domain,base_category,short_description,keywords
reddit.com/r/redheads,addictive,"A community for redheads and those who appreciate them, featuring photos and discussions about natural redheads","redheads, natural redheads, photos, community"
reddit.com/r/relationship_advice,addictive,"Advice, support, and discussions on relationships. Share, seek, and find guidance from a community of 16M members.","relationship advice, dating guidance, personal relationship support"
reddit.com/r/relationships,addictive,"r/relationships is a community on Reddit where users share their experiences and seek advice on various relationship-related topics, including romantic relationships, friendships, and personal growth.","relationships, dating, advice, romance, friendships, personal growth"
reddit.com/r/roadcam,addictive,Reddit's r/Roadcam community shares videos of notable road situations from around the world.,"roadcam videos, reddit r/roadcam, traffic incident sharing"
reddit.com/r/rule34,addictive,"A subreddit for sharing Rule 34 content, featuring adult artwork and animations from various fandoms and series.","rule 34, adult content, fandom artwork"
reddit.com/r/runningbholechallenge,addictive,Access denied: r/runningbholechallenge subreddit banned due to lack of moderation.,"reddit banned subreddit, runningbholechallenge, subreddit moderation"
reddit.com/r/science,productive,"r/science: A Reddit community for sharing & discussing scientific research, studies, and news across various fields like Health, Social Science, and more.","science community, scientific research discussions, reddit r/science"
reddit.com/r/sexinfrontofothers,addictive,Access denied: r/sexinfrontofothers subreddit is banned due to being unmoderated.,"banned subreddit, unmoderated community, reddit access denied"
reddit.com/r/sextrophies,addictive,"Sextrophies OC, a community of 879k members sharing photos and discussions on beauty, confidence, and self-acceptance.","sextrophies, oc, confidence, beauty, self-acceptance"
reddit.com/r/shemakeshersuck,addictive,Subreddit not found: r/SheMakesHerSuck is banned due to being unmoderated.,"banned subreddit, unmoderated community, reddit error"
reddit.com/r/showerthoughts,productive,"Share and discover random, often humorous thoughts that pop up in the shower.","shower thoughts, reddit community, humor"
reddit.com/r/skylerlo,addictive,"This is a transcript of a Reddit community page dedicated to Skyler Lo. It includes rules, links to her social media and content platforms (OnlyFans, MyFreeCams, Instagram, Twitter), and a discussion thread with images and comments. The community focuses solely on content related to Skyler Lo and enforces rules against rudeness, shady links, piracy, and general violations of Reddit's policies. The page also lists moderators and provides links to Reddit's legal documents.","skyler lo, reddit, community, onlyfans, myfreecams, instagram, twitter, content, rules, moderators, social media, adult content, skylerlo, fan page"
reddit.com/r/sloppyblowjob,addictive,"Banned subreddit r/sloppyblowjob, previously dedicated to discussing mature content.","banned subreddit, mature content, reddit community"
reddit.com/r/slowcooking,productive,"This is a summary of a Reddit community focused on slow cooking (Crock-Pot recipes). Key rules include posting only Crock-Pot recipes with included recipes, prohibiting crude/hateful comments, memes, and political content. The community was created 15 years ago and is public.","slow cooking, crock-pot, recipes, reddit, community, rules, food, cooking, public"
reddit.com/r/slut,addictive,Community sharing adult content and discussions,"adult content, nsfw, subreddit"
reddit.com/r/soccer,productive,"Reddit's r/soccer community: Discuss, share, and engage with global soccer (football) news, highlights, and fan culture.","r/soccer, soccer community, football discussions, reddit soccer forum"
reddit.com/r/space,productive,"Community for space news, articles, and discussion with 28M members sharing NASA, cosmology, and astronomy updates.","space news, astronomy community, nasa updates, cosmology discussion"
reddit.com/r/sports,productive,"Reddit's r/sports community: Discuss news, updates, and highlights from various sports like Hockey, Golf, Football, and more.","sports news, reddit sports community, multi-sport discussions"
reddit.com/r/squirting,addictive,Reddit community for discussion and sharing of squash techniques and tips,"squash, racquet sports, sports community"
reddit.com/r/stacked,addictive,"This is a dump of Reddit content from the r/Stacked subreddit, including posts, comments, rules, and community information. The content focuses on original content (OC) and explicitly prohibits names, personal information, and reposts. There are rules regarding verification for posting OC and limitations on posting frequency. The subreddit also promotes a third-party scheduling tool, Postpone.","reddit, stacked, subreddit, oc, original content, rules, verification, posting, community, adult content, postpone, scheduling, names, personal information, reposts"
reddit.com/r/straightgirlsplaying,addictive,"This is a text excerpt from a Reddit page, specifically from the subreddit 'StraightGirlsPlaying'. It showcases recent posts with titles like 'Flashing leads to kissing', 'Flashing leads to kissing', and 'Flashing leads to kissing', along with links to the original posts and user information. The page also includes standard Reddit footer links and resources.","reddit, straightgirlsplaying, subreddit, posts, flashing, kissing, online community, internet culture, recent posts, footer, resources"
reddit.com/r/stripgirls,addictive,"Community sharing and discussing strip girls content, featuring beautiful girls stripping and other adult content.","strip girls, stripping, adult content"
reddit.com/r/suicidegirls,addictive,"Community for fans of SuicideGirls.com featuring adult content, models, and galleries.","suicidegirls, adult content, models, galleries"
reddit.com/r/summertimegirls,addictive,"Banned subreddit for Summertime Girls community, previously unmoderated.","summertime girls, reddit community, banned subreddit"
reddit.com/r/sydneysweeney,addictive,"Sydney Sweeney fan community on Reddit with 301K members sharing news, photos, and discussions about the actress.","sydney sweeney, actress, celebrity"
reddit.com/r/tattoos,addictive,"This appears to be a collection of advertisements and a post from Reddit's r/Tattoos. The first section promotes Adobe products, specifically mentioning 'generate backgrounds' and 'AI'. The second section showcases a full leg tattoo created by Ivan Zagusta at Zaraza tattoo shop in Warsaw, Poland, with multiple images and details.","advertisement, adobe, ai, generate backgrounds, tattoo, leg tattoo, ivan zagusta, zaraza tattoo shop, warsaw, poland, reddit, r/tattoos"
reddit.com/r/teachers,productive,"Reddit community for teachers to share experiences, discuss challenges, and connect with peers in education.","teachers community, education forum, reddit r/teachers"
reddit.com/r/technology,productive,"Discuss and share the latest news, developments, and trends in technology.","technology news, tech updates, online community"
reddit.com/r/teensnsfw,addictive,Access denied: subreddit banned for violating Reddit's content policy against sexual or suggestive content involving minors.,"reddit, banned subreddit, content policy"
reddit.com/r/television,distracting,"Reddit community for Television Discussion & News | 18M members sharing TV show reviews, news, and recommendations","television news, tv show discussions, reddit community"
reddit.com/r/theratio,addictive,"A community for girls with wide hips and narrow waists, showcasing their bodies while following strict rules to maintain a respectful and safe space.","hips to waist ratio, body positivity, female community"
reddit.com/r/thick,addictive,"Community for women with curves, featuring images and discussions","thick women, curvy women, adult content"
reddit.com/r/thick_hentai,addictive,"This appears to be a collection of links and content scraped from the subreddit r/thick_hentai. The content revolves around sexually suggestive themes and depictions of women, including topics like 'thick' women, female bosses, and aunts. The language and imagery are exploitative and objectifying.","thick_hentai, sexual_content, objectification, exploitation, women, milf, reddit, subreddits, sexual_themes, explicit_content"
reddit.com/r/tifu,productive,Share funny stories of your epic fails and learn from others' mistakes on Reddit's r/tifu community.,"tifu, reddit, epic fails, mistakes, funny stories"
reddit.com/r/tightdresses,addictive,"This is a description of the subreddit r/tightdresses, outlining its rules and content focus. The subreddit is dedicated to images of females in tight dresses and skirts. Key rules include restrictions on nudity (requiring NSFW flagging and spoiler tags), a focus on the dress/skirt itself, politeness towards original content submitters, and prohibitions against minors, creepshots, crossdressers, and AI-generated content. Reposting restrictions are also in place.","r/tightdresses, subreddit, tight dresses, tight skirts, rules, nsfw, content, community, females, skirts, dresses, original content, oc, minors, creepshots, ai, reposts"
reddit.com/r/tinytits,addictive,A community dedicated to celebrating and appreciating small-breasted women,"small breasts, tiny tits, breast appreciation"
reddit.com/r/tittydrop,addictive,"TittyDrop community on Reddit, featuring risqué content and user-shared images.","reddit community, tittydrop, nsfw content"
reddit.com/r/todayilearned,productive,Community-driven forum sharing daily discoveries & interesting facts on various topics.,"today i learned, reddit r/todayilearned, interesting facts"
reddit.com/r/toocuteforporn,addictive,"This is a collection of posts from the r/TooCuteForPorn subreddit, containing suggestive and explicit content. The posts include titles like 'would u jerk off to a lil bunny like me?', 'She was bound to get us caught had I not kept her from making too much noise 😅', and 'would u jerk off to a lil bunny like me?'. The content appears to involve depictions of individuals and suggestive scenarios.","r/toocuteforporn, subreddit, explicit, suggestive, bunny, jerk off, caught, depictions, scenarios, sexual content"
reddit.com/r/trashyboners,addictive,A banned subreddit community for mature content due to lack of moderation.,"reddit community, mature content, banned subreddit"
reddit.com/r/travel,neutral,"Reddit's r/travel: Community for travel discussions, tips, and experiences. Share and discover advice on destinations, safety, and more.","travel community, travel tips, destination advice"
reddit.com/r/trippinthroughtime,addictive,"This is a text dump from Reddit, specifically from the r/InternetCulture subreddit. It contains several promoted and regular posts, including comments and images. The posts cover topics like internet culture, games, Q&As, technology, pop culture, and movies & TV. The dump also includes links to Reddit's rules, privacy policy, user agreement, and various resources like Reddit Pro and the blog.","reddit, internetculture, viral, games, q&as, technology, popculture, movies, tv, comments, images, redditrules, redditpro, redditblog"
reddit.com/r/twoxchromosomes,addictive,A community for women to discuss various topics and share their experiences.,"women, community, discussion, experiences, reddit"
reddit.com/r/unashamed,addictive,r/unashamed is a banned subreddit that was removed due to lack of moderation.,"reddit, banned subreddit, unmoderated"
reddit.com/r/underratedbitches,addictive,Underrated Bitches community on Reddit,"reddit community, underrated bitches, banned subreddit"
reddit.com/r/videos,distracting,"r/videos: Reddit community sharing miscellaneous videos, trending clips, and user-submitted content. 27M+ members.","reddit videos, video sharing community, trending clips"
reddit.com/r/vscosluts,addictive,r/vscosluts: A banned subreddit removed for excessive copyright violations.,"banned subreddit, reddit community, copyright removals"
reddit.com/r/watchitfortheplot,addictive,"A Reddit community dedicated to sharing and discussing movies and TV shows, focusing on actresses and their roles.","actresses, movies, tv shows, watch it for the plot"
reddit.com/r/wedgiegirls,addictive,"This is a collection of text and image descriptions from the r/Wedgies subreddit, including posts, rules, and community information. It covers topics like wedgie-related content, age restrictions, image hosting, spam prevention, and community guidelines regarding professional content and relationships.","wedgies, subreddit, reddit, community, rules, guidelines, content, age restriction, image hosting, spam, professional content, relationships, female on male, customs, patreon, onlyfans"
reddit.com/r/wellthatsucks,addictive,Share & discuss life's unfortunate moments,"misfortune stories, reddit community, unfortunate events"
reddit.com/r/whatcouldgowrong,addictive,"This appears to be a collection of Reddit post titles and thumbnails from the r/Whatcouldgowrong subreddit. The posts cover a range of humorous and relatable situations, including someone filming a burning car and a warning about not revealing your next move. There are also promoted posts included.","reddit, r/whatcouldgowrong, humor, relatable, burning car, strategy, promoted posts, online content, social media"
reddit.com/r/whenitgoesin,addictive,"Access restricted subreddit whenitgoesin on Reddit, a community-driven platform where users share and discuss content.","reddit, subreddit, banned community"
reddit.com/r/whiptrax,addictive,"This appears to be a scraped webpage from the Reddit community 'whiptrax'. The page details a post titled 'Falling in Love With Her Nipples', featuring adult content. It includes information about the community's rules, moderators, links to external platforms (OnlyFans, Twitter, Patreon), and a list of related Reddit topics and subreddits.","reddit, whiptrax, adult content, onlyfans, twitter, patreon, community, nipples, post, internet culture, gaming, q&a"
reddit.com/r/wholesomememes,addictive,"This is a collection of content from the r/wholesomememes subreddit, including promoted posts, community bookmarks, and rules. It features wholesome memes, affirmations, and community guidelines. The content includes images with text, and focuses on uplifting and positive themes.","wholesomememes, reddit, memes, wholesome, positive, uplifting, affirmations, community, rules, images, text, promotion, original content"
reddit.com/r/woahdude,addictive,"This is a collection of content from the subreddit r/woahdude, including a visual illusion/puzzle, a video of mesmerizing motion art, and a link to a related subreddit (r/oddlysatisfying). It also includes community information, rules, and a list of top communities. The content emphasizes trippy and mesmerizing visuals, discouraging posts that are merely cool or unusual.","woahdude, trippy, mesmerizing, visual illusion, motion art, oddlysatisfying, community rules, reddit, subreddits, visuals, art, puzzle"
reddit.com/r/woodworking,productive,"Reddit's r/woodworking community: Share, discuss, and learn woodworking projects, techniques, and tools with fellow enthusiasts.","woodworking community, wood projects, woodworking forum"
reddit.com/r/workgonewild,addictive,"This is a collection of posts from a restricted subreddit focused on adult content featuring women at work. The content includes suggestive and explicit descriptions and images, and the subreddit has strict rules regarding membership, photo authenticity, and location (must be at a physical workplace). There's a verification process involving Snapchat and a live video call.","subreddit, adult content, women, workplace, restricted, snapchat, verification, rules, explicit, suggestive, wfh, gonewild"
reddit.com/r/wouldyoufuckmywife,addictive,NSFW adult community sharing explicit content and engaging in discussions,"adult content, nsfw community, explicit discussions"
reddit.com/r/writingprompts,productive,"A Reddit community for writers, offering creative writing prompts, motivation, and a platform to share stories, with thousands of members and daily engaging content.","writing prompts, creative writing community, reddit r/writingprompts"
reddit.com/r/wtf,addictive,"This appears to be a collection of posts from the r/WTF subreddit, including an advertisement for monday.com, a post about needing to go to the bathroom, and a reminder of the subreddit's rules regarding screenshots, personal information, and outrage posts. The content is varied and reflects the nature of the WTF subreddit.","wtf, subreddit, reddit, advertisement, monday.com, bathroom, rules, screenshots, personal information, outrage, humor, weird, strange"
reddit.com/r/xboxone,addictive,"Discussion community for Xbox One news, games, and updates on Reddit, now migrated to r/Xbox for centralized content.","xbox one, reddit community, xbox news"
reddit.com/r/xxxgamesreview,addictive,Banned subreddit for adult gaming reviews and discussions.,"xxx games review, adult gaming community, banned subreddit"
redfin.com,productive,"Explore homes for sale, rentals, and mortgage options nationwide. Get pre-approved, find agents, and more with Redfin's real estate platform.","homes for sale, rentals, mortgage pre-approval, real estate agents"
redis.io,productive,"Redis.io - The Real-time Data Platform for building fast, reliable apps with caching, database, and vector search capabilities.","redis, real-time data platform, caching solution"
redlib.catsarch.com,neutral,"Redlib is an alternative private front-end to Reddit, providing a curated experience with popular posts and feeds.","reddit alternative, private front-end, curated content"
redlib.ducks.party,neutral,"This JSON object summarizes content from Reddit posts across various subreddits, including AITAH, MadeMeSmile, r/AITAH, and others. The posts cover topics ranging from a marital dispute and family dynamics to heartwarming moments and a humorous image. The AITAH post details a complex situation involving a divorce, an affair, custody arrangements, and a request from the ex-wife to take on responsibility for her child.","reddit, aitah, mademesmile, family, divorce, custody, affair, relationships, marriage, child, gifts, humor, custody battle, parenting, reddit posts"
redmine.org,productive,"Redmine is a flexible, open-source project management web application. Manage projects, issues, wikis, and more with this powerful tool.","project management, issue tracking, redmine, open source, collaboration"
redream.io,addictive,"Experience the Dreamcast reimagined in HD with redream.io, a high-performance emulator for Windows, Mac, Linux, Android, and Raspberry Pi 4, offering easy gameplay of over 95% of the Dreamcast library in high definition.","dreamcast emulator, hd emulation, retro gaming"
redstate.com,distracting,"RedState - Conservative news, opinion, and politics","conservative news, politics, opinion"
redstone.xyz,productive,"Redstone.xyz: A Layer 2 blockchain platform for on-chain games and autonomous worlds, offering low fees, fast edge RPCs, and automatic MUD indexing.","on-chain games, layer 2 blockchain, autonomous worlds"
redtube.com,addictive,"Redtube, an adult content platform, is unavailable in Kentucky due to age verification issues, advocating for device-based verification solutions.","adult content, age verification, online safety"
redwoodjs.com,productive,"RedwoodJS evolves with Redwood GraphQL for stable full-stack web development & introduces RedwoodSDK for personal, modular software creation on modern serverless infrastructure.","redwoodjs, redwoodsdk, full-stack web development, serverless software development framework"
regery.com,distracting,"Regery.com: Affordable domain registration, SSL certificates, web hosting, and site monitoring. Instant registration, free SSL options, and global domain extensions.","domain registration, ssl certificates, web hosting, domain management"
reliance.com,distracting,Reliance Steel & Aluminum Co. - Leading diversified metal solutions provider offering a wide range of metal products and services through its family of companies.,"metal solutions provider, steel & aluminum supplier, diversified metal products"
remembear.com,neutral,"Securely store & access your passwords with RememBear. Simple, easy-to-use app for remembering all your login details. (Service discontinued)","password manager, passwords, security, remembear, login"
remind.com,productive,"Remind: Communication Platform for Education - Connect with students, families, and educators via two-way messaging, Hub for school-wide communication, supporting learning and engagement.","education communication platform, school-family messaging, two-way classroom messaging"
remnote.com,productive,"Join 1M+ students to improve studying and organization with RemNote, a comprehensive tool that combines notes, flashcards, and PDF annotation for efficient learning.","study app, notes and flashcards, pdf annotation"
remote.co,productive,"Remote.co is a remote work job board and resources platform for online job seekers and companies hiring, offering a range of remote job listings and insights from leading companies.","remote job board, remote work, job search"
remotive.io,productive,"Find and apply to the best remote jobs in programming, support, design, and more with hand-curated listings.","remote jobs, job search, career opportunities"
renderhub.com,addictive,"Discover a vast marketplace for 3D models, textures, and assets for various software like Blender, Maya, and Unity, with a community-driven platform for 3D artists and game developers.","3d models, marketplace, 3d assets"
renproject.io,productive,"GitHub Pages site not found, setup documentation and status updates provided.","github pages, site not found, error 404"
rent.com,productive,"Search houses, apartments, condos, & townhouses for rent in the US. Efficient rental search platform.","rentals in us, apartment search, houses for rent"
rentalcars.com,neutral,"Book cheap car rentals in 60,000+ locations worldwide. Compare prices, free cancellations, and 30+ languages supported. Reserve online today!","car rental, cheap car rentals, online car booking, rentalcars.com"
renweb.com,productive,"FACTS provides education technology & services for K-12 schools, supporting educators with solutions like student info systems, enrollment tools, and more.","education technology, k-12 school solutions, student information system"
reown.com,productive,"Reown provides onchain UX platforms & toolkits for developers to build intuitive, scalable, and secure user experiences across various blockchain applications.","onchain ux, blockchain development tools, web3 user experience"
replicate.com,productive,"Replicate: Cloud API for running open-source machine learning models. Easily deploy, fine-tune, and access AI models.","ai api, cloud machine learning, open-source model deployment"
replika.ai,productive,"Create a personalized AI friend and companion to chat, share experiences, and explore together.","ai companion, personalized chatbot, emotional support"
replit.app,productive,Replit.app - Access Unavailable,"error 404, not found, website unavailable"
replit.com,productive,"Replit – Build and deploy web apps, sites, automations, and more with AI-powered development tools in minutes, no setup required.","ai app development, cloud-based coding, no-code web development"
replit.dev,productive,"Build and deploy apps and websites quickly with Replit's AI-powered platform, no coding required.","ai-powered development, app creation platform, no-code development"
repubblica.it,distracting,Error page indicating a temporary connection issue or configuration error with CloudFront.,"cloudfront error, 403 forbidden, website unavailable"
republic.co,productive,"Republic.co - Invest in startups, crypto, and more with as little as $50. Access private markets, token launchpads, web3 advisory, and global marketplaces.","startup investing, crypto investing, web3 platform"
request.network,productive,"Web3 infrastructure for invoicing, payments, and accounting at scale.","web3 payments, blockchain invoicing, crypto payment integration"
researchgate.net,productive,"ResearchGate is a social networking site for scientists, researchers, and academics to share research, collaborate, and find job opportunities.","research networking, academic collaboration, scientific community"
resemble.ai,productive,"Generate, clone, and customize AI voices with Resemble.ai's text-to-speech, speech-to-speech, and voice cloning solutions.","ai voice generator, text to speech, voice cloning"
respeecher.com,productive,"Respeecher's AI voice generator creates realistic text-to-speech voices for various industries, including film, music, and healthcare.","ai voice generator, text-to-speech (tts) solutions, voice cloning technology"
resso.com,distracting,Error 502: Bad Gateway page for resso.com,"bad gateway, error 502, website error"
restream.io,addictive,"Multistream live video to 30+ destinations simultaneously with Restream's platform, also offering a live streaming studio and video upload-to-stream features.","multistreaming, live video platform, live streaming studio"
retailmenot.com,distracting,RetailMeNot is a coupons and promo codes website that requires security verification to access its deals and discounts.,"coupons, promo codes, discounts"
retroarch.com,addictive,"RetroArch: A cross-platform frontend for emulators, game engines, and media players, enabling classic game playback with unified settings and advanced features.","retroarch, emulator frontend, classic game emulation"
