domain,base_category,short_description,keywords
0x.org,productive,"0x.org provides powerful APIs for developers to build financial apps on crypto rails, enabling faster crypto trading, better prices, and superior UX.","crypto apis, defi development tools, blockchain trading apis"
1.1.1.1,neutral,"Make your Internet faster, private, and reliable with the free 1.1.1.1 app, featuring a modern optimized protocol for a safer online experience.","internet speed, online privacy, dns resolver"
10bet.com,addictive,10bet.com is not accessible in your country due to restrictions.,"online betting, betting restrictions, gaming limitations"
126.com,productive,网易126免费邮箱-你的专业电子邮局，提供快速稳定安全的邮箱服务，支持超大附件和网盘。,"免费邮箱, 专业电子邮局, 邮箱服务"
1fichier.com,distracting,"Secure cloud storage service to store, access, and share files with end-to-end encryption and renewable energy.","cloud storage, file sharing, secure hosting"
1inch.io,productive,"Explore the 1inch Network, a DeFi ecosystem offering a suite of products like 1inch dApp, Wallet, Developer Portal, Portfolio, and Fusion for secure Web3 operations.","defi, web3, 1inch network"
1password.com,neutral,Password Manager & Extended Access Management solutions for personal and business security,"password manager, extended access management, cybersecurity"
1xbet.com,addictive,Restricted access to online betting and gaming website for users in the USA.,"online betting, gaming website, restricted access"
2checkout.com,productive,"Accept online payments anywhere with 2Checkout's secure payment processing solutions, supporting credit cards, PayPal, and more.","online payment processing, ecommerce payment solutions, global payment gateway"
32red.com,addictive,"32Red: UK's top online casino with a vast selection of slots, live dealer games, and progressive jackpots. Enjoy generous bonuses and instant payouts.","online casino uk, casino games, slots, live dealer, jackpots"
360learning.com,productive,"Upskill employees, train customers, and enable partners with 360Learning, a comprehensive learning platform designed for collaborative learning and measurable L&D impact.","learning platform, collaborative learning, l&d, employee upskilling, customer training"
3dns.box,productive,"Tokenized domain registration and management platform, providing on-chain domains with self-custody and seamless Web3 integration.","tokenized domains, on-chain domains, web3 integration, domain registration, self-custody"
3dns.io,productive,"3dns.io, a registered ENS (Ethereum Name Service) domain, facilitating decentralized navigation and interaction.","ens domain, decentralized navigation, ethereum name service"
3docean.net,addictive,"3DOcean offers over 49,100+ 3D print files & CG textures starting at $2, empowering global 3D printing projects with community-driven designs.","3d print files, cg textures, 3d printing marketplace"
3speak.tv,addictive,Censorship-resistant video platform where creators can earn cryptocurrency by sharing content.,"censorship resistant video platform, earn cryptocurrency through video content, tokenised video community"
4everland.org,productive,"4EVERLAND: Cloud Computing Platform for Web3.0 | Full-service suite for building Web3 DApps, including decentralized storage, hosting, gateway, RPC, RaaS, and AI solutions.","web3 cloud platform, decentralized storage solutions, web3 dapp development tools"
4everland.store,productive,"4EVERLAND - A cloud computing platform of Web3.0, offering a full-service solution for building Web3 DApps with storage, gateway, DWeb hosting, RPC, RaaS, and AI solutions.","web3 cloud computing, dapp development, decentralized storage"
4shared.com,productive,"4shared offers free file sharing & storage with 15 GB of space, allowing users to upload, discover, and share files easily across various categories like music, videos, images, apps, and books.","file sharing, free storage, cloud storage platform"
7bitcasino.com,addictive,"Licensed Bitcoin Casino offering the best crypto games, bonuses up to 1.5 BTC, 100 free spins, and 24/7 support.","bitcoin casino, crypto games, online slots, live casino, casino bonuses"
7cups.com,neutral,"7 Cups offers free emotional support and therapy with caring listeners and licensed therapists, providing a safe space to talk and feel better","online therapy, mental health community, emotional support"
7digital.com,distracting,7digital provides a technology platform for brands and services to connect with licensed music from any label or publisher using integrated APIs.,"music solutions, licensed music, api services"
80.lv,addictive,"80 Level: Industry platform for game devs, digital artists & VFX specialists. Learn workflows, discuss tools & share work.","game development, digital art, vfx"
888casino.com,addictive,Online Casino | Casino Bonus 200% up to £200 | 888 Casino,"online casino, casino bonus, casino games"
888sport.com,addictive,"Bet on sports online with competitive odds at 888sport. Enjoy in-play betting, Bet Builder, and more on various sports events. T&Cs Apply.","online sports betting, sports odds, in-play betting"
8x8.com,productive,"8x8.com offers an AI-powered platform unifying contact center, unified communications, and APIs for seamless customer experiences and enhanced business efficiency.","ai-powered contact center, unified communications, cx platform"
9monsters.com,distracting,"9Monsters.com is for sale, offering an extensive selection of high-quality domain names with knowledgeable and friendly customer support.","domain names, hugedomains, domain for sale"
9news.com.au,distracting,"9News delivers breaking news, live updates, and in-depth coverage of Australian and global events, including politics, crime, and entertainment.","australian news, breaking news updates, global headlines"
aa.com,neutral,"Book airline tickets, hotels, car rentals, and vacations with American Airlines. Earn miles on every trip and redeem for flights, hotels, and more.","airline tickets, flights, vacations"
aaron.com,distracting,"Raymond Aaron, top success coach, transforms lives through mentorship, free resources, and his podcast 'Respark Your Life', helping people achieve success and income growth.","success coaching, raymond aaron, personal development, mentorship programs"
aave.com,productive,"Access DeFi's full power with Aave, a non-custodial liquidity protocol for supplying, borrowing, swapping, and staking assets with variable interest rates across multiple networks.","defi liquidity protocol, non-custodial borrowing, cross-network defi platform"
aax.com,productive,AAX.com users with outstanding balances can register claims as creditors in the liquidation of Atom Holdings. Learn more and submit your claim at [link].,"aax, liquidation, claims, creditors, atom holdings"
abc.net.au/news,distracting,"ABC News - Australia's trusted source for latest news, in-depth analysis, and live coverage across various categories including Politics, World, Business, Sport, and more.","australian news, latest headlines, news analysis"
abcnews.go.com,distracting,"ABC News: Trusted source for breaking news, analysis, exclusive videos, and live coverage of US and international events.","breaking news, abc news, us news, international news, live news coverage"
abebooks.com,distracting,"Shop millions of used, rare, collectible books, and art from sellers worldwide. Discover deals under $10 with free US shipping.","used books, rare books, collectible books"
abracadabra.money,productive,"Abracadabra.money, currently unavailable in your location, apologizes for the inconvenience.","abracadabra.money, location restriction, inaccessible"
absorblms.com,productive,"Absorb LMS: AI-powered Learning Management System for enterprises, offering scalable training solutions with advanced features, integrations, and top-rated support.","ai-powered lms, learning management system, enterprise training solutions"
academia.edu,productive,"Academia.edu: Share, discover, and explore over 50 million research papers across various disciplines.","research papers, academic platform, scholarly content"
acast.com,distracting,"Acast is the world's leading independent podcast company, elevating podcast creators and advertisers for the ultimate listening experience.","podcasting, podcast creators, podcast advertisers"
accor.com,neutral,"Discover unique hospitality experiences across 5,600+ hotels in 45+ brands, 110+ countries","accor hotels, hospitality group, global bookings"
accusoft.com,productive,"Accusoft specializes in content processing, conversion, and automation software, enabling document viewing, AI-powered processing, image manipulation, and contract automation solutions.","document processing software, content automation, image processing toolkit"
aclu.org,neutral,"The ACLU works to create a more perfect union by defending and expanding civil liberties for all through litigation, advocacy, and education, as promised by the US Constitution.","civil liberties, aclu, constitutional rights"
acretrader.com,productive,"This document describes AcreTrader, a platform for investing in farmland. It highlights the benefits of farmland investment, including potential land value appreciation and annual cash rent payments. The document also provides data comparing farmland performance against other asset classes like bonds, REITs, and the S&P 500. It includes contact information, FAQs, terms of use, and links to AcreTrader's social media profiles.","farmland, investment, real estate, agriculture, acretrader, land, cash rent, assets, returns, finance, property, farmland investment, alternative investment"
across.to,productive,"Experience seamless crosschain interoperability with Across Protocol, connecting users with applications through Intents.","crosschain interoperability, intents, seamless experiences"
actionagainsthunger.org,neutral,"Action Against Hunger works in over 55 countries to save lives, end hunger & malnutrition through innovative programs, advocacy & emergency response, helping 24M people annually.","global hunger relief, malnutrition prevention, humanitarian aid organization"
activision.com,addictive,"This document showcases recent news and updates from Activision, covering topics like Call of Duty (Warzone, Mobile, Black Ops Cold War), Crash Bandicoot, and the announcement of a new studio, Elsewhere Entertainment. It includes details on upcoming seasons, map returns (Verdansk), new content, and holiday gift guides.  There's also information about the release of the Caldera data set for academic use.","activision, call of duty, warzone, black ops cold war, call of duty mobile, crash bandicoot, elsewhere entertainment, verdansk, caldera, holiday gift guide, season updates, new studio, data set, gaming, news, updates"
activitypub.rocks,addictive,"ActivityPub Rocks! is a resource for ActivityPub, a W3C-recommended decentralized social networking protocol. Find guides, test suites, and community forums for implementers and users.","activitypub, decentralized social networking, w3c standard protocol"
ada.com,neutral,"AI-powered health app for symptom assessment & medical library powered by clinicians, offering personalized health management & resources.","ai health app, symptom assessment tool, medical health library"
addthis.com,productive,"Oracle offers integrated cloud applications and platform services for enterprises, including cloud infrastructure, AI, and industry-specific solutions.","oracle cloud, cloud applications, enterprise cloud solutions"
addy.io,productive,Create unlimited free email aliases to protect your real email from spam. Anonymous email forwarding with privacy-friendly features.,"email aliases, anonymous email forwarding, spam protection"
adept.ai,productive,"Adept is an enterprise AI tool that enhances productivity by managing manual, repetitive workflows across the tools your teams use daily.","ai workflow automation, enterprise ai tool, productivity enhancement"
adguard-dns.io,neutral,"AdGuard DNS: A privacy-oriented DNS service blocking ads, trackers, and malicious domains, with parental control and customizable filtering.","ad-blocking dns, private dns server, parental control dns"
adguard.com/dns,neutral,"Block ads and trackers with AdGuard DNS, a cloud-based DNS service that protects your privacy and provides an ad-free experience.","adguard dns, ad blocker, dns service, privacy protection"
adidas.com/runtastic,neutral,"Adidas Runtastic is a fitness platform to track and improve your runs, workouts, and overall well-being.","runtastic, fitness platform, running app"
adobe.com,productive,"Adobe offers creative, marketing, and document management solutions, including Creative Cloud, Adobe Acrobat, and Experience Manager, empowering users to create, optimize, and manage digital content and experiences.","creative cloud, adobe acrobat, digital content creation"
adp.com,productive,"ADP offers payroll, HR, tax, compliance, and benefit administration solutions for businesses of all sizes.","payroll services, hr solutions, tax compliance solutions"
adrive.com,productive,"ADrive offers cloud storage, online backup solutions for personal, business, and enterprise users with scalable plans and advanced features.","cloud storage, online backup, cloud solutions"
adultcamlover.com,addictive,"Watch 100% free uncensored live adult cams with live cam girls and couples, no registration required!","adult cams, live sex cams, free adult webcams, adult cam chat"
adultcamstars.com,addictive,"Free adult live webcams from amateurs worldwide! Join 100% free and discover new models, private shows, and more.","live webcams, adult cams, free chat"
adultfriendfinder.com,distracting,"Meet new people and explore casual dating, friendships, and relationships in the world's largest online dating community.","adult dating, online dating community, casual relationships"
adultnode.com,addictive,"This is a webpage from the adult website Chaturbate. It features a lengthy legal disclaimer regarding age verification and consent, followed by news updates, a direct messaging interface, and user information. The page emphasizes privacy and security, and promotes various features like private shows and token purchases. It also includes links to sign up, log in, and provide feedback.","chaturbate, adult website, legal disclaimer, age verification, consent, privacy, security, private shows, tokens, news, direct messaging, sign up, log in, feedback"
adyen.com,productive,"Adyen provides end-to-end payments, data, and financial management in one solution, helping businesses grow through seamless online & in-person payments, fraud management, and unified commerce capabilities.","payments platform, financial technology, unified commerce, fraud management"
aerodrome.finance,productive,"Aerodrome Finance is a decentralized exchange on Base network, offering low-fee swaps, token deposits for rewards, and on-chain economy participation.","decentralized exchange, liquidity marketplace, base network"
aether.com,addictive,"Purchase the premium domain name aether.com, inquire now for the best guaranteed price.","domain name for sale, aether.com, premium domain purchase"
af.com,distracting,"AmericanFriends.com (AF.com) - Under Construction, utilizing cookies for service and ad personalization.","americanfriends.com, af.com, coming soon, cookie usage policy"
affinity.serif.com/designer,addictive,"Affinity Designer is a professional vector graphics editor offering a subscription-free, one-off payment option. It's available for macOS, Windows, and iPadOS, providing versatile design capabilities for various projects, including vector illustration, UI/UX design, and typography. Key features include support for various file formats, compatibility across devices, and a powerful suite of tools for creating high-quality designs. The Affinity V2 Universal License offers access to Affinity Designer, Photo, and Publisher on all platforms for a single payment.","affinity designer, vector graphics, design software, graphic design, illustration, ui/ux, typography, macos, windows, ipados, subscription-free, one-off payment, affinity photo, affinity publisher, universal license, file formats, compatibility, vector illustration, digital art"
agno.com,productive,"Agno: An open-source platform for building, deploying, and managing model-agnostic AI agents with scalability, flexibility, and integrations.","ai agents platform, model agnostic ai, open-source ai deployment"
agoda.com,neutral,"Book over 2 million hotels, homes, flights, and activities worldwide with free cancellation and discounts on Agoda.","hotel booking, travel accommodations, flight booking, vacation activities"
agora.io,productive,"Agora.io provides flexible APIs for real-time communication, enabling developers to create interactive experiences with conversational AI, video, voice, chat, and more.","real-time communication apis, conversational ai, live streaming solutions"
agoracitizen.network,productive,"Agora Citizen Network: A purpose-built platform for meaningful civic dialogues, fostering large-scale discussions on social & political issues with depolarizing algorithms, human-only interactions, and open-source transparency.","civic dialogue platform, depolarizing social network, open-source civic engagement"
aioz.network,productive,"AIOZ Network is a decentralized platform powering web3, AI, streaming, and storage solutions with its DePIN technology and blockchain integration.","web3, decentralized cdn, depin"
aiozpin.network,productive,"AIOZ Pin offers next-gen media distribution with advanced Web3 IPFS storage, enabling fast and reliable content delivery.","ipfs storage, web3 media distribution, content delivery network"
airbnb.io,productive,"Airbnb's engineering & data science hub featuring open-source projects, tech blog posts, and innovations in software development, data science, and mobile app engineering.","airbnb engineering, open source projects, data science innovations, mobile app development, software engineering blog"
aircall.io,productive,"Aircall is an AI-powered customer communications platform that unifies channels, automates tasks, and provides insights for high-performing teams.","business phone system, customer communications platform, ai-powered conversation intelligence"
airchain.com,neutral,"Domain parking page for airchain.com, reserved by GoDaddy LLC.","domain parking, godaddy, airchain.com"
airtable.com,productive,"Airtable is a low-code platform to build next-gen apps, operationalize critical data, and reimagine workflows with AI.","airtable, low-code, next-gen apps, ai"
aiva.ai,productive,"AIVA, an AI music generation assistant, creates custom songs in seconds with 250+ styles and ultimate customizability, ideal for music makers and creators.","ai music generation, music composition, generative ai"
ajbell.co.uk,productive,"Award-winning investment platform for DIY investors offering low-cost SIPPs, ISAs, junior ISAs, and dealing accounts with a range of investment options and tools.","investment platform, diy investing, sipp, isa, junior isa, dealing account"
akash.network,productive,"Decentralized compute marketplace for securely buying and selling computing resources, offering flexible and scalable infrastructure solutions.","decentralized compute, cloud resources, akash network"
akkoma.social,addictive,"Join Akkoma, a decentralized social media platform in the fediverse, offering expressive posting, fediverse-wide interactions, and a fast, customizable experience.","akkoma, fediverse social media, decentralized social network, activitypub protocol"
alamo.com,neutral,"This is a webpage content from Alamo car rental, featuring information about reservation options, Alamo Insiders program, standard of care, deals, and accelerated check-in. It includes links to various Alamo services and promotional offers.","alamo, car rental, reservation, alamo insiders, deals, accelerated check-in, standard of care, plan ahead specials, last minute deal, one-way rental"
alaskaair.com,neutral,"Book flights to 1,000+ destinations with Alaska Airlines & oneworld Alliance. Find deals, manage bookings, and more.","alaska airlines, flight bookings, airline tickets, travel deals"
alchemix.fi,productive,"Alchemix offers self-repaying, liquidation-free loans & yielding assets, secured by collateral, for flexible, stress-free borrowing in DeFi.","self-repaying loans, defi yield borrowing, liquidation-free loans"
alexandriabooks.com,productive,"Alexandriabooks.com: Own, collect, & cherish limited edition digital e-books & audiobooks, safe from censorship, utilizing blockchain for permanence & scarcity.","digital collectible books, blockchain publishing, limited edition ebooks"
alienworlds.io,addictive,"Explore and build in Alien Worlds, a community-driven metaverse where players collect NFTs, compete for Trilium, and shape the narrative.","metaverse, nfts, gaming"
alienworlds.io/market,addictive,"Explore Alien Worlds, a player-owned metaverse for play-to-earn gaming, mining, teleportation, and missions in a blockchain-driven galaxy.","play-to-earn gaming, blockchain metaverse, alien worlds marketplace"
alison.com,productive,"Alison offers free online courses with certificates & diplomas across various subjects, empowering career growth and upskilling with offline learning capabilities.","free online courses, certified learning, career upskilling"
allbridge.io,productive,"Cross-chain bridge for tokens, enabling seamless swaps between EVM and non-EVM blockchains.","cross-chain bridge, token swap, blockchain bridge"
allegorithmic.com,addictive,"Design stunning 3D models with Adobe Substance 3D! Explore apps, textures, AI-powered tools & workflows for creating immersive scenes. Try it now!","3d design, substance 3d, texturing, modeling, adobe"
allnodes.com,productive,"This document provides a list of cryptocurrencies and related services offered by Allnodes, including masternodes, validator nodes, sentry nodes, full nodes, staking, address monitoring, and a bot for performance updates. It also highlights recent announcements regarding Blast, Nibiru, and Bitcoin support with free RPC endpoints and snapshots. The document emphasizes Allnodes' features for easy setup, attractive rewards, and reliable uptime.","cryptocurrency, blockchain, allnodes, masternode, validator node, sentry node, full node, staking, address monitoring, rpc endpoints, snapshots, blast, nibiru, bitcoin, public node, rewards, uptime, performance, bot"
almaweb.com,productive,"IP Home offers integrated services for business startups, including company name creation, brand naming, trademark and domain name registration.","brand naming, trademark registration, domain name registration"
alpha.org,distracting,"Alpha offers an 11-week online/in-person course creating a space for conversations about faith, life, and God. Join, donate, or run Alpha.","alpha course, faith discussions, christianity resources"
alphaflow.com,productive,Domain for sale: alphaflow.com - Get a price quote within 24 hours,"domain for sale, alphaflow.com, domain pricing quote"
alt.xyz,productive,"Buy & sell rare trading cards, sports memorabilia & exclusive items via Alt's live marketplace, featuring auctions, trending players, and recently added listings.","trading card marketplace, auction site for sports memorabilia, rare collectibles exchange"
altana.com,productive,Global leader in true specialty chemicals - ALTANA AG,"specialty chemicals, altana ag, true specialty chemicals"
altered.ai,productive,"AI voice changer software for professional media production, real-time communication, and content creation with voice morphing, cloning, and text-to-speech.","ai voice changer, voice morphing software, professional voice editing"
alternet.org,distracting,"Alternet.org: Breaking news, political & investigative journalism from a progressive perspective.","progressive news, investigative journalism, us politics"
amateur.tv,addictive,"Watch free live sex cams & adult webcams with real people. Chat with naked cam girls, guys, and couples without registration.","live sex cams, adult webcams, free live porn"
amateurporn.net,addictive,"Amateur Porn offers free memberships to save videos, add to favorites and more, with a huge selection of amateur porn videos in over 30 categories, updated daily.","amateur porn, free porn videos, homemade porn"
amazon.com,distracting,"Shop online at Amazon, the world's largest online retailer, offering a wide range of products including electronics, books, clothing, home goods, and more.","online shopping, amazon, products, electronics, books"
amazon.com/chime,productive,Amazon Chime - a communication service for online meetings and video conferencing,"amazon chime, video conferencing, online meetings"
amazon.com/firetv,addictive,"Shop Amazon Fire TV for streaming devices, smart TVs, and more. Access tens of thousands of channels, apps, and Alexa skills.","fire tv, streaming devices, smart tvs, amazon alexa"
amazon.com/primevideo,distracting,"Stream a wide selection of movies, TV shows, live TV, and sports on Prime Video.","prime video, movies, tv shows, live tv, sports"
